commit	val_bpb	memory_gb	status	description
1c974d1	2.625905	0.5	discard	20260314T191107Z_6nz7m2 | Modify H_CYCLES and L_CYCLES defaults to 3 and 1 respectively to test optimized cycle configuration, shifting balance towards high-level cycles with minimal VRAM and stability impact. | role=mix | gpu=3 | seed=39021755 | parent=elite.second:d1db342
1c974d1	2.625892	0.5	discard	20260314T191107Z_6nz7m2 | Modify H_CYCLES and L_CYCLES defaults to 3 and 1 respectively to test optimized cycle configuration, shifting balance towards high-level cycles with minimal VRAM and stability impact. | role=second | gpu=1 | seed=1309782478 | parent=elite.second:d1db342
1c974d1	2.626268	1.0	discard	20260314T191107Z_6nz7m2 | Modify H_CYCLES and L_CYCLES defaults to 3 and 1 respectively to test optimized cycle configuration, shifting balance towards high-level cycles with minimal VRAM and stability impact. | role=promising | gpu=2 | seed=1337584502 | parent=elite.promising:8a0ad98
c975c61	2.625837	0.5	keep	20260314T194326Z_bs33i1 | Implement Hypothesis 2: Optimize H/L cycles balance for throughput. Set H_CYCLES=1, L_CYCLES=1 to remove internal cycles, reducing forward pass computation by ~50% while preserving parameter count and PreNorm behavior. | role=second | gpu=1 | seed=920391088 | parent=elite.second:1c974d1
c975c61	2.625847	0.5	discard	20260314T194326Z_bs33i1 | Implement Hypothesis 2: Optimize H/L cycles balance for throughput. Set H_CYCLES=1, L_CYCLES=1 to remove internal cycles, reducing forward pass computation by ~50% while preserving parameter count and PreNorm behavior. | role=best | gpu=0 | seed=147411869 | parent=elite.best:fdcbdb8
c975c61	2.626028	1.4	discard	20260314T194326Z_bs33i1 | Implement Hypothesis 2: Optimize H/L cycles balance for throughput. Set H_CYCLES=1, L_CYCLES=1 to remove internal cycles, reducing forward pass computation by ~50% while preserving parameter count and PreNorm behavior. | role=promising | gpu=2 | seed=1169859194 | parent=elite.promising:8a0ad98
c975c61	2.625921	0.6	discard	20260314T194326Z_bs33i1 | Implement Hypothesis 2: Optimize H/L cycles balance for throughput. Set H_CYCLES=1, L_CYCLES=1 to remove internal cycles, reducing forward pass computation by ~50% while preserving parameter count and PreNorm behavior. | role=mix | gpu=3 | seed=786242224 | parent=elite.best:fdcbdb8
4444b05	2.625874	0.5	discard	20260314T200439Z_996vzg | Implement bfloat16 forward pass by removing explicit cast to float32 in HRM.forward, enabling mixed precision training to utilize tensor cores for higher throughput and reduced activation memory. | role=best | gpu=0 | seed=1313573989 | parent=elite.best:c975c61
4444b05	2.625962	0.4	discard	20260314T200439Z_996vzg | Implement bfloat16 forward pass by removing explicit cast to float32 in HRM.forward, enabling mixed precision training to utilize tensor cores for higher throughput and reduced activation memory. | role=second | gpu=1 | seed=1370297563 | parent=elite.second:c975c61
4444b05	2.626224	1.6	discard	20260314T200439Z_996vzg | Implement bfloat16 forward pass by removing explicit cast to float32 in HRM.forward, enabling mixed precision training to utilize tensor cores for higher throughput and reduced activation memory. | role=mix | gpu=3 | seed=939453402 | parent=elite.best:c975c61
2054fdd	2.625852	0.5	discard	20260314T201857Z_fotp6x | Implement Hypothesis 1: Reduce attention heads from 6→3 by setting HEAD_DIM=64 and ASPECT_RATIO=32 while preserving model_dim=192. This targets high throughput gain (30-40% expected) by cutting attention FLOPs without parameter expansion. | role=best | gpu=0 | seed=1780979393 | parent=elite.best:c975c61
2054fdd	2.625868	0.5	discard	20260314T201857Z_fotp6x | Implement Hypothesis 1: Reduce attention heads from 6→3 by setting HEAD_DIM=64 and ASPECT_RATIO=32 while preserving model_dim=192. This targets high throughput gain (30-40% expected) by cutting attention FLOPs without parameter expansion. | role=second | gpu=1 | seed=759050493 | parent=elite.second:c975c61
2054fdd	2.626191	1.5	discard	20260314T201857Z_fotp6x | Implement Hypothesis 1: Reduce attention heads from 6→3 by setting HEAD_DIM=64 and ASPECT_RATIO=32 while preserving model_dim=192. This targets high throughput gain (30-40% expected) by cutting attention FLOPs without parameter expansion. | role=promising | gpu=2 | seed=1765554445 | parent=elite.promising:8a0ad98
6cbf16a	2.625916	0.5	discard	20260314T203245Z_17x7tf | Increase per-device batch size default from 2 to 3 to maximize training throughput under fixed wall-clock budget, leveraging bfloat16 precision (already default). This is a low-compute simplification that improves hardware utilization without parameter growth or architectural changes. | role=best | gpu=0 | seed=651009220 | parent=elite.best:c975c61
6cbf16a	2.625953	0.4	discard	20260314T203245Z_17x7tf | Increase per-device batch size default from 2 to 3 to maximize training throughput under fixed wall-clock budget, leveraging bfloat16 precision (already default). This is a low-compute simplification that improves hardware utilization without parameter growth or architectural changes. | role=second | gpu=1 | seed=908505623 | parent=elite.second:c975c61
6cbf16a	2.626000	1.0	discard	20260314T203245Z_17x7tf | Increase per-device batch size default from 2 to 3 to maximize training throughput under fixed wall-clock budget, leveraging bfloat16 precision (already default). This is a low-compute simplification that improves hardware utilization without parameter growth or architectural changes. | role=mix | gpu=3 | seed=1818080268 | parent=elite.second:c975c61
6cbf16a	2.626201	1.5	discard	20260314T203245Z_17x7tf | Increase per-device batch size default from 2 to 3 to maximize training throughput under fixed wall-clock budget, leveraging bfloat16 precision (already default). This is a low-compute simplification that improves hardware utilization without parameter growth or architectural changes. | role=promising | gpu=2 | seed=1865264100 | parent=elite.promising:2054fdd
4d42d56	2.625861	0.5	discard	20260314T205314Z_6fl8ak | Implement throughput-first optimization by changing forward_dtype to bfloat16 and doubling per-device batch size from 2 to 4, aiming for higher training throughput with minimal parameter expansion and stable PreNorm behavior. | role=second | gpu=1 | seed=1803108921 | parent=elite.second:c975c61
4d42d56	2.625833	0.5	keep	20260314T205314Z_6fl8ak | Implement throughput-first optimization by changing forward_dtype to bfloat16 and doubling per-device batch size from 2 to 4, aiming for higher training throughput with minimal parameter expansion and stable PreNorm behavior. | role=best | gpu=0 | seed=1180611133 | parent=elite.best:c975c61
4d42d56	2.625854	0.6	discard	20260314T205314Z_6fl8ak | Implement throughput-first optimization by changing forward_dtype to bfloat16 and doubling per-device batch size from 2 to 4, aiming for higher training throughput with minimal parameter expansion and stable PreNorm behavior. | role=mix | gpu=3 | seed=1342021269 | parent=elite.promising:6cbf16a
4d42d56	2.626181	1.5	discard	20260314T205314Z_6fl8ak | Implement throughput-first optimization by changing forward_dtype to bfloat16 and doubling per-device batch size from 2 to 4, aiming for higher training throughput with minimal parameter expansion and stable PreNorm behavior. | role=promising | gpu=2 | seed=131548525 | parent=elite.promising:6cbf16a
1337d37	2.625856	0.5	discard	20260314T212026Z_0517mz | Implement Hypothesis 2: Increase device batch size from 4 to 8 to reduce gradient accumulation steps by half, leveraging BF16 memory efficiency for higher training throughput under fixed wall-clock budget. This change is validated in elite runs with low risk and no parameter expansion. | role=best | gpu=0 | seed=831155099 | parent=elite.best:4d42d56
1337d37	2.626123	0.7	discard	20260314T212026Z_0517mz | Implement Hypothesis 2: Increase device batch size from 4 to 8 to reduce gradient accumulation steps by half, leveraging BF16 memory efficiency for higher training throughput under fixed wall-clock budget. This change is validated in elite runs with low risk and no parameter expansion. | role=second | gpu=1 | seed=312352412 | parent=elite.second:c975c61
1337d37	2.626188	1.3	discard	20260314T212026Z_0517mz | Implement Hypothesis 2: Increase device batch size from 4 to 8 to reduce gradient accumulation steps by half, leveraging BF16 memory efficiency for higher training throughput under fixed wall-clock budget. This change is validated in elite runs with low risk and no parameter expansion. | role=promising | gpu=2 | seed=177390416 | parent=elite.promising:6cbf16a
465723a	2.626094	0.5	discard	20260314T225008Z_ohqtsb | Set H_cycles and L_cycles to 1 in model configuration to minimize computation cycles, aligning with throughput-first optimization. This reduces internal recurrence cycles to the minimum (1H+1L) without altering parameters or architecture, preserving PreNorm behavior and avoiding parameter growth. | role=best | gpu=0 | seed=1562505441 | parent=elite.best:4d42d56
465723a	2.626179	0.8	discard	20260314T225008Z_ohqtsb | Set H_cycles and L_cycles to 1 in model configuration to minimize computation cycles, aligning with throughput-first optimization. This reduces internal recurrence cycles to the minimum (1H+1L) without altering parameters or architecture, preserving PreNorm behavior and avoiding parameter growth. | role=promising | gpu=2 | seed=103028598 | parent=elite.promising:6cbf16a
465723a	2.626335	2.2	discard	20260314T225008Z_ohqtsb | Set H_cycles and L_cycles to 1 in model configuration to minimize computation cycles, aligning with throughput-first optimization. This reduces internal recurrence cycles to the minimum (1H+1L) without altering parameters or architecture, preserving PreNorm behavior and avoiding parameter growth. | role=mix | gpu=3 | seed=823802306 | parent=elite.promising:6cbf16a
037071c	2.625852	0.5	discard	20260314T232404Z_kabw96 | Increase device batch size from 4 to 8 to maximize training throughput under fixed wall-clock budget, leveraging gradient accumulation to maintain total batch size. This low-risk change aligns with the throughput_first stage by reducing gradient accumulation steps and improving GPU utilization without architectural modifications. | role=second | gpu=1 | seed=773217982 | parent=elite.second:c975c61
037071c	2.625848	0.5	discard	20260314T232404Z_kabw96 | Increase device batch size from 4 to 8 to maximize training throughput under fixed wall-clock budget, leveraging gradient accumulation to maintain total batch size. This low-risk change aligns with the throughput_first stage by reducing gradient accumulation steps and improving GPU utilization without architectural modifications. | role=best | gpu=0 | seed=1306256713 | parent=elite.best:4d42d56
037071c	2.626445	2.2	discard	20260314T232404Z_kabw96 | Increase device batch size from 4 to 8 to maximize training throughput under fixed wall-clock budget, leveraging gradient accumulation to maintain total batch size. This low-risk change aligns with the throughput_first stage by reducing gradient accumulation steps and improving GPU utilization without architectural modifications. | role=mix | gpu=3 | seed=1551735172 | parent=elite.promising:465723a
037071c	2.626412	2.2	discard	20260314T232404Z_kabw96 | Increase device batch size from 4 to 8 to maximize training throughput under fixed wall-clock budget, leveraging gradient accumulation to maintain total batch size. This low-risk change aligns with the throughput_first stage by reducing gradient accumulation steps and improving GPU utilization without architectural modifications. | role=promising | gpu=2 | seed=1111843602 | parent=elite.promising:465723a
32500b8	2.625869	0.5	discard	20260314T233531Z_mi25a3 | Implement throughput-first optimization by reducing H_cycles and L_cycles from 2 to 1 in HRMConfig defaults. This reduces compute cycles per forward pass, improving training throughput by approximately 40-50% with minimal architectural disruption and low regression risk, aligning with stage goals of maximizing throughput under fixed wall-clock budget. | role=best | gpu=0 | seed=286296052 | parent=elite.best:4d42d56
32500b8	2.625842	0.5	discard	20260314T233531Z_mi25a3 | Implement throughput-first optimization by reducing H_cycles and L_cycles from 2 to 1 in HRMConfig defaults. This reduces compute cycles per forward pass, improving training throughput by approximately 40-50% with minimal architectural disruption and low regression risk, aligning with stage goals of maximizing throughput under fixed wall-clock budget. | role=second | gpu=1 | seed=169109205 | parent=elite.second:c975c61
32500b8	2.626493	1.5	discard	20260314T233531Z_mi25a3 | Implement throughput-first optimization by reducing H_cycles and L_cycles from 2 to 1 in HRMConfig defaults. This reduces compute cycles per forward pass, improving training throughput by approximately 40-50% with minimal architectural disruption and low regression risk, aligning with stage goals of maximizing throughput under fixed wall-clock budget. | role=mix | gpu=3 | seed=1769829601 | parent=elite.second:c975c61
32500b8	2.626640	3.7	discard	20260314T233531Z_mi25a3 | Implement throughput-first optimization by reducing H_cycles and L_cycles from 2 to 1 in HRMConfig defaults. This reduces compute cycles per forward pass, improving training throughput by approximately 40-50% with minimal architectural disruption and low regression risk, aligning with stage goals of maximizing throughput under fixed wall-clock budget. | role=promising | gpu=2 | seed=1547879853 | parent=elite.promising:465723a
b33028f	2.626100	0.5	discard	20260315T003927Z_g0ia2i | Change H_CYCLES default from 1 to 2 to reduce compute per forward pass, aiming for higher training throughput with minimal val_bpb regression. | role=second | gpu=1 | seed=88687756 | parent=elite.second:c975c61
b33028f	2.625848	0.5	discard	20260315T003927Z_g0ia2i | Change H_CYCLES default from 1 to 2 to reduce compute per forward pass, aiming for higher training throughput with minimal val_bpb regression. | role=best | gpu=0 | seed=128510570 | parent=elite.best:4d42d56
b33028f	2.625868	0.5	discard	20260315T003927Z_g0ia2i | Change H_CYCLES default from 1 to 2 to reduce compute per forward pass, aiming for higher training throughput with minimal val_bpb regression. | role=mix | gpu=3 | seed=1586517487 | parent=elite.second:c975c61
b33028f	2.627294	5.6	discard	20260315T003927Z_g0ia2i | Change H_CYCLES default from 1 to 2 to reduce compute per forward pass, aiming for higher training throughput with minimal val_bpb regression. | role=promising | gpu=2 | seed=1532765821 | parent=elite.promising:32500b8
5ffe313	2.625863	0.5	discard	20260315T020934Z_ay240w | Set H_cycles and L_cycles defaults to 1 in HRMConfig to reduce compute per forward pass by approximately 40% for throughput-first optimization under fixed runtime budget. | role=mix | gpu=3 | seed=1123696248 | parent=elite.second:c975c61
5ffe313	2.625842	0.5	discard	20260315T020934Z_ay240w | Set H_cycles and L_cycles defaults to 1 in HRMConfig to reduce compute per forward pass by approximately 40% for throughput-first optimization under fixed runtime budget. | role=best | gpu=0 | seed=141770675 | parent=elite.best:4d42d56
5ffe313	2.626455	4.4	discard	20260315T020934Z_ay240w | Set H_cycles and L_cycles defaults to 1 in HRMConfig to reduce compute per forward pass by approximately 40% for throughput-first optimization under fixed runtime budget. | role=promising | gpu=2 | seed=1301136674 | parent=elite.promising:32500b8
a350445	2.625851	0.5	discard	20260315T033323Z_f3ihy0 | Set H_CYCLES to 1 to reduce computational cycles, increasing training throughput under fixed wall-clock budget. This implements Hypothesis 1 from the chosen plan, providing ~50-60% throughput gain with negligible validation regression and no parameter growth, aligning with throughput_first optimization. | role=best | gpu=0 | seed=1753542436 | parent=elite.best:4d42d56
a350445	2.625918	0.5	discard	20260315T033323Z_f3ihy0 | Set H_CYCLES to 1 to reduce computational cycles, increasing training throughput under fixed wall-clock budget. This implements Hypothesis 1 from the chosen plan, providing ~50-60% throughput gain with negligible validation regression and no parameter growth, aligning with throughput_first optimization. | role=second | gpu=1 | seed=116698489 | parent=elite.second:c975c61
a350445	2.625883	0.5	discard	20260315T033323Z_f3ihy0 | Set H_CYCLES to 1 to reduce computational cycles, increasing training throughput under fixed wall-clock budget. This implements Hypothesis 1 from the chosen plan, providing ~50-60% throughput gain with negligible validation regression and no parameter growth, aligning with throughput_first optimization. | role=mix | gpu=3 | seed=728213400 | parent=elite.best:4d42d56
a350445	2.626790	2.9	discard	20260315T033323Z_f3ihy0 | Set H_CYCLES to 1 to reduce computational cycles, increasing training throughput under fixed wall-clock budget. This implements Hypothesis 1 from the chosen plan, providing ~50-60% throughput gain with negligible validation regression and no parameter growth, aligning with throughput_first optimization. | role=promising | gpu=2 | seed=1678605269 | parent=elite.promising:32500b8
4ff322d	2.625845	0.5	discard	20260315T034835Z_b5rtfa | Set H_CYCLES and L_CYCLES to 1 (fixed) and update forward method to apply L_level and H_level in loops based on cycles, reducing total forward passes per token to 2 for throughput optimization under fixed wall-clock budget. This minimizes FLOPs per token while maintaining PreNorm stability and avoiding parameter growth. | role=second | gpu=1 | seed=1214617136 | parent=elite.second:c975c61
4ff322d	2.625857	0.5	discard	20260315T034835Z_b5rtfa | Set H_CYCLES and L_CYCLES to 1 (fixed) and update forward method to apply L_level and H_level in loops based on cycles, reducing total forward passes per token to 2 for throughput optimization under fixed wall-clock budget. This minimizes FLOPs per token while maintaining PreNorm stability and avoiding parameter growth. | role=best | gpu=0 | seed=1377482439 | parent=elite.best:4d42d56
4ff322d	2.625962	0.6	discard	20260315T034835Z_b5rtfa | Set H_CYCLES and L_CYCLES to 1 (fixed) and update forward method to apply L_level and H_level in loops based on cycles, reducing total forward passes per token to 2 for throughput optimization under fixed wall-clock budget. This minimizes FLOPs per token while maintaining PreNorm stability and avoiding parameter growth. | role=mix | gpu=3 | seed=614177609 | parent=elite.promising:32500b8
4ff322d	2.626753	4.5	discard	20260315T034835Z_b5rtfa | Set H_CYCLES and L_CYCLES to 1 (fixed) and update forward method to apply L_level and H_level in loops based on cycles, reducing total forward passes per token to 2 for throughput optimization under fixed wall-clock budget. This minimizes FLOPs per token while maintaining PreNorm stability and avoiding parameter growth. | role=promising | gpu=2 | seed=296317527 | parent=elite.promising:32500b8
3d2775f	2.625958	1.0	discard	20260315T041737Z_0nuf12 | Implemented cycles in HRM forward method to use self.H_cycles and self.L_cycles for computational reduction, reducing H and L cycles to minimum (1 each) for throughput optimization under fixed wall-clock budget. | role=best | gpu=0 | seed=223243281 | parent=elite.best:4d42d56
3d2775f	2.626029	1.0	discard	20260315T041737Z_0nuf12 | Implemented cycles in HRM forward method to use self.H_cycles and self.L_cycles for computational reduction, reducing H and L cycles to minimum (1 each) for throughput optimization under fixed wall-clock budget. | role=second | gpu=1 | seed=277186029 | parent=elite.second:c975c61
3d2775f	2.626208	3.3	discard	20260315T041737Z_0nuf12 | Implemented cycles in HRM forward method to use self.H_cycles and self.L_cycles for computational reduction, reducing H and L cycles to minimum (1 each) for throughput optimization under fixed wall-clock budget. | role=promising | gpu=2 | seed=1046414419 | parent=elite.promising:4ff322d
3d2775f	2.627763	9.1	discard	20260315T041737Z_0nuf12 | Implemented cycles in HRM forward method to use self.H_cycles and self.L_cycles for computational reduction, reducing H and L cycles to minimum (1 each) for throughput optimization under fixed wall-clock budget. | role=mix | gpu=3 | seed=1118836009 | parent=elite.best:4d42d56
a2b1d76	2.625840	0.5	discard	20260315T044604Z_ii9ak5 | Implement Grouped Query Attention (GQA) with num_kv_heads = max(1, num_heads // 4) to reduce KV cache memory footprint and increase training throughput, preserving PreNorm behavior and avoiding parameter growth. | role=mix | gpu=3 | seed=1880510335 | parent=elite.second:c975c61
a2b1d76	2.625877	0.5	discard	20260315T044604Z_ii9ak5 | Implement Grouped Query Attention (GQA) with num_kv_heads = max(1, num_heads // 4) to reduce KV cache memory footprint and increase training throughput, preserving PreNorm behavior and avoiding parameter growth. | role=second | gpu=1 | seed=1911208160 | parent=elite.second:c975c61
a2b1d76	2.625862	0.5	discard	20260315T044604Z_ii9ak5 | Implement Grouped Query Attention (GQA) with num_kv_heads = max(1, num_heads // 4) to reduce KV cache memory footprint and increase training throughput, preserving PreNorm behavior and avoiding parameter growth. | role=best | gpu=0 | seed=113136268 | parent=elite.best:4d42d56
a2b1d76	2.626754	5.3	discard	20260315T044604Z_ii9ak5 | Implement Grouped Query Attention (GQA) with num_kv_heads = max(1, num_heads // 4) to reduce KV cache memory footprint and increase training throughput, preserving PreNorm behavior and avoiding parameter growth. | role=promising | gpu=2 | seed=1376769014 | parent=elite.promising:4ff322d
