commit	val_bpb	memory_gb	status	description
b89b9b3	2.626710	2.7	discard	gpu1 second run1773492319 DEPTH=8 HEAD_DIM=32 ASPECT_RATIO=64 H_CYCLES=2 L_CYCLES=2 FORWARD_DTYPE=bfloat16 PRENORM=0 LAYER_SCALE_INIT=0.0 DEVICE_BATCH_SIZE=2 TOTAL_BATCH_SIZE=65536 EMBEDDING_LR=0.3 MATRIX_LR=0.04582603489983622 UNEMBEDDING_LR=0.004 WEIGHT_DECAY=0.15 WARMUP_RATIO=0.0 WARMDOWN_RATIO=0.5 FINAL_LR_FRAC=0.0 LOGITS_SOFTCAP=15.0 ZERO_O_PROJ_INIT=1
b89b9b3	2.626647	2.7	discard	gpu0 best run1773492319 DEPTH=8 HEAD_DIM=32 ASPECT_RATIO=64 H_CYCLES=2 L_CYCLES=2 FORWARD_DTYPE=bfloat16 PRENORM=0 LAYER_SCALE_INIT=0.0 DEVICE_BATCH_SIZE=2 TOTAL_BATCH_SIZE=65536 EMBEDDING_LR=0.309082243972838 MATRIX_LR=0.044351174853283215 UNEMBEDDING_LR=0.0035354440460033296 WEIGHT_DECAY=0.15 WARMUP_RATIO=0.0 WARMDOWN_RATIO=0.5 FINAL_LR_FRAC=0.0 LOGITS_SOFTCAP=15.0 ZERO_O_PROJ_INIT=1
b89b9b3	2.626723	2.7	discard	gpu3 mix run1773492319 DEPTH=8 HEAD_DIM=32 ASPECT_RATIO=64 H_CYCLES=2 L_CYCLES=2 FORWARD_DTYPE=bfloat16 PRENORM=0 LAYER_SCALE_INIT=0.0 DEVICE_BATCH_SIZE=2 TOTAL_BATCH_SIZE=65536 EMBEDDING_LR=0.3057207422469668 MATRIX_LR=0.044351174853283215 UNEMBEDDING_LR=0.004 WEIGHT_DECAY=0.15 WARMUP_RATIO=0.0 WARMDOWN_RATIO=0.5 FINAL_LR_FRAC=0.0 LOGITS_SOFTCAP=15.0 ZERO_O_PROJ_INIT=1
b89b9b3	2.626867	2.7	discard	gpu2 promising run1773492319 DEPTH=8 HEAD_DIM=32 ASPECT_RATIO=61 H_CYCLES=3 L_CYCLES=2 FORWARD_DTYPE=bfloat16 PRENORM=0 LAYER_SCALE_INIT=0.0 DEVICE_BATCH_SIZE=2 TOTAL_BATCH_SIZE=65536 EMBEDDING_LR=0.3 MATRIX_LR=0.04 UNEMBEDDING_LR=0.004 WEIGHT_DECAY=0.15 WARMUP_RATIO=0.02 WARMDOWN_RATIO=0.5 FINAL_LR_FRAC=0.0 LOGITS_SOFTCAP=15.0 ZERO_O_PROJ_INIT=1
b89b9b3	2.626689	2.7	discard	gpu1 second run1773492860 DEPTH=8 HEAD_DIM=32 ASPECT_RATIO=64 H_CYCLES=2 L_CYCLES=2 FORWARD_DTYPE=bfloat16 PRENORM=0 LAYER_SCALE_INIT=0.0 DEVICE_BATCH_SIZE=2 TOTAL_BATCH_SIZE=65536 EMBEDDING_LR=0.3 MATRIX_LR=0.044351174853283215 UNEMBEDDING_LR=0.0035354440460033296 WEIGHT_DECAY=0.15 WARMUP_RATIO=0.0 WARMDOWN_RATIO=0.5 FINAL_LR_FRAC=0.0 LOGITS_SOFTCAP=15.0 ZERO_O_PROJ_INIT=1
b89b9b3	2.626779	2.8	discard	gpu0 best run1773492860 DEPTH=8 HEAD_DIM=32 ASPECT_RATIO=64 H_CYCLES=2 L_CYCLES=2 FORWARD_DTYPE=float32 PRENORM=0 LAYER_SCALE_INIT=0.0 DEVICE_BATCH_SIZE=2 TOTAL_BATCH_SIZE=65536 EMBEDDING_LR=0.309082243972838 MATRIX_LR=0.044351174853283215 UNEMBEDDING_LR=0.0035354440460033296 WEIGHT_DECAY=0.15 WARMUP_RATIO=0.0 WARMDOWN_RATIO=0.5 FINAL_LR_FRAC=0.0 LOGITS_SOFTCAP=15.0 ZERO_O_PROJ_INIT=1
b89b9b3	2.626998	2.7	discard	gpu3 mix run1773492860 DEPTH=8 HEAD_DIM=32 ASPECT_RATIO=64 H_CYCLES=3 L_CYCLES=2 FORWARD_DTYPE=bfloat16 PRENORM=0 LAYER_SCALE_INIT=0.0 DEVICE_BATCH_SIZE=2 TOTAL_BATCH_SIZE=65536 EMBEDDING_LR=0.3 MATRIX_LR=0.044351174853283215 UNEMBEDDING_LR=0.0035354440460033296 WEIGHT_DECAY=0.15 WARMUP_RATIO=0.0 WARMDOWN_RATIO=0.5 FINAL_LR_FRAC=0.0 LOGITS_SOFTCAP=15.0 ZERO_O_PROJ_INIT=1
b89b9b3	2.626984	2.7	discard	gpu2 promising run1773492860 DEPTH=8 HEAD_DIM=32 ASPECT_RATIO=64 H_CYCLES=3 L_CYCLES=2 FORWARD_DTYPE=bfloat16 PRENORM=0 LAYER_SCALE_INIT=0.0 DEVICE_BATCH_SIZE=2 TOTAL_BATCH_SIZE=65536 EMBEDDING_LR=0.3 MATRIX_LR=0.04 UNEMBEDDING_LR=0.004 WEIGHT_DECAY=0.15 WARMUP_RATIO=0.02 WARMDOWN_RATIO=0.5 FINAL_LR_FRAC=0.0 LOGITS_SOFTCAP=15.0 ZERO_O_PROJ_INIT=1
b89b9b3	2.626753	2.7	discard	gpu3 mix run1773493399 DEPTH=8 HEAD_DIM=32 ASPECT_RATIO=64 H_CYCLES=2 L_CYCLES=1 FORWARD_DTYPE=bfloat16 PRENORM=0 LAYER_SCALE_INIT=0.0 DEVICE_BATCH_SIZE=2 TOTAL_BATCH_SIZE=65536 EMBEDDING_LR=0.3 MATRIX_LR=0.044351174853283215 UNEMBEDDING_LR=0.0035354440460033296 WEIGHT_DECAY=0.15 WARMUP_RATIO=0.0 WARMDOWN_RATIO=0.5 FINAL_LR_FRAC=0.0 LOGITS_SOFTCAP=15.0 ZERO_O_PROJ_INIT=1
b89b9b3	2.626787	2.7	discard	gpu1 second run1773493399 DEPTH=8 HEAD_DIM=32 ASPECT_RATIO=64 H_CYCLES=2 L_CYCLES=2 FORWARD_DTYPE=bfloat16 PRENORM=0 LAYER_SCALE_INIT=0.0 DEVICE_BATCH_SIZE=2 TOTAL_BATCH_SIZE=65536 EMBEDDING_LR=0.3 MATRIX_LR=0.044351174853283215 UNEMBEDDING_LR=0.0035354440460033296 WEIGHT_DECAY=0.15 WARMUP_RATIO=0.0 WARMDOWN_RATIO=0.5 FINAL_LR_FRAC=0.0 LOGITS_SOFTCAP=15.0 ZERO_O_PROJ_INIT=1
b89b9b3	2.626699	2.7	discard	gpu0 best run1773493399 DEPTH=8 HEAD_DIM=32 ASPECT_RATIO=64 H_CYCLES=2 L_CYCLES=2 FORWARD_DTYPE=bfloat16 PRENORM=0 LAYER_SCALE_INIT=0.0 DEVICE_BATCH_SIZE=2 TOTAL_BATCH_SIZE=65536 EMBEDDING_LR=0.309082243972838 MATRIX_LR=0.044351174853283215 UNEMBEDDING_LR=0.0035354440460033296 WEIGHT_DECAY=0.15 WARMUP_RATIO=0.0 WARMDOWN_RATIO=0.5 FINAL_LR_FRAC=0.0 LOGITS_SOFTCAP=10.0 ZERO_O_PROJ_INIT=1
b89b9b3	2.627060	2.7	discard	gpu2 promising run1773493399 DEPTH=8 HEAD_DIM=32 ASPECT_RATIO=61 H_CYCLES=3 L_CYCLES=2 FORWARD_DTYPE=bfloat16 PRENORM=0 LAYER_SCALE_INIT=0.0 DEVICE_BATCH_SIZE=2 TOTAL_BATCH_SIZE=65536 EMBEDDING_LR=0.3210755279753274 MATRIX_LR=0.04 UNEMBEDDING_LR=0.004 WEIGHT_DECAY=0.15 WARMUP_RATIO=0.02 WARMDOWN_RATIO=0.5 FINAL_LR_FRAC=0.0 LOGITS_SOFTCAP=15.0 ZERO_O_PROJ_INIT=1
b89b9b3	2.626710	2.7	discard	gpu0 best run1773493935 DEPTH=8 HEAD_DIM=32 ASPECT_RATIO=64 H_CYCLES=2 L_CYCLES=2 FORWARD_DTYPE=bfloat16 PRENORM=0 LAYER_SCALE_INIT=0.0 DEVICE_BATCH_SIZE=2 TOTAL_BATCH_SIZE=65536 EMBEDDING_LR=0.309082243972838 MATRIX_LR=0.044351174853283215 UNEMBEDDING_LR=0.0035354440460033296 WEIGHT_DECAY=0.15 WARMUP_RATIO=0.0 WARMDOWN_RATIO=0.5 FINAL_LR_FRAC=0.0 LOGITS_SOFTCAP=15.0 ZERO_O_PROJ_INIT=1
b89b9b3	2.626712	2.7	discard	gpu3 mix run1773493935 DEPTH=8 HEAD_DIM=32 ASPECT_RATIO=64 H_CYCLES=2 L_CYCLES=2 FORWARD_DTYPE=bfloat16 PRENORM=0 LAYER_SCALE_INIT=0.0 DEVICE_BATCH_SIZE=2 TOTAL_BATCH_SIZE=65536 EMBEDDING_LR=0.3 MATRIX_LR=0.044351174853283215 UNEMBEDDING_LR=0.0035354440460033296 WEIGHT_DECAY=0.15 WARMUP_RATIO=0.0 WARMDOWN_RATIO=0.5 FINAL_LR_FRAC=0.0 LOGITS_SOFTCAP=15.0 ZERO_O_PROJ_INIT=1
b89b9b3	2.626776	2.8	discard	gpu1 second run1773493935 DEPTH=8 HEAD_DIM=32 ASPECT_RATIO=64 H_CYCLES=2 L_CYCLES=2 FORWARD_DTYPE=float32 PRENORM=0 LAYER_SCALE_INIT=0.0 DEVICE_BATCH_SIZE=2 TOTAL_BATCH_SIZE=65536 EMBEDDING_LR=0.3 MATRIX_LR=0.044351174853283215 UNEMBEDDING_LR=0.0035354440460033296 WEIGHT_DECAY=0.15 WARMUP_RATIO=0.0 WARMDOWN_RATIO=0.5 FINAL_LR_FRAC=0.0 LOGITS_SOFTCAP=15.0 ZERO_O_PROJ_INIT=1
b89b9b3	2.627042	2.8	discard	gpu2 promising run1773493935 DEPTH=8 HEAD_DIM=32 ASPECT_RATIO=61 H_CYCLES=3 L_CYCLES=2 FORWARD_DTYPE=float32 PRENORM=0 LAYER_SCALE_INIT=0.0 DEVICE_BATCH_SIZE=2 TOTAL_BATCH_SIZE=65536 EMBEDDING_LR=0.3 MATRIX_LR=0.04 UNEMBEDDING_LR=0.004 WEIGHT_DECAY=0.15 WARMUP_RATIO=0.02 WARMDOWN_RATIO=0.5 FINAL_LR_FRAC=0.0 LOGITS_SOFTCAP=15.0 ZERO_O_PROJ_INIT=1
b89b9b3	2.627270	2.7	discard	gpu0 best run1773494678 DEPTH=8 HEAD_DIM=32 ASPECT_RATIO=64 H_CYCLES=2 L_CYCLES=1 FORWARD_DTYPE=bfloat16 PRENORM=0 LAYER_SCALE_INIT=0.0 DEVICE_BATCH_SIZE=2 TOTAL_BATCH_SIZE=65536 EMBEDDING_LR=0.309082243972838 MATRIX_LR=0.044351174853283215 UNEMBEDDING_LR=0.0035354440460033296 WEIGHT_DECAY=0.15 WARMUP_RATIO=0.0 WARMDOWN_RATIO=0.5 FINAL_LR_FRAC=0.0 LOGITS_SOFTCAP=15.0 ZERO_O_PROJ_INIT=1
b89b9b3	2.626759	2.7	discard	gpu3 mix run1773494678 DEPTH=8 HEAD_DIM=32 ASPECT_RATIO=64 H_CYCLES=2 L_CYCLES=2 FORWARD_DTYPE=bfloat16 PRENORM=0 LAYER_SCALE_INIT=0.0 DEVICE_BATCH_SIZE=2 TOTAL_BATCH_SIZE=65536 EMBEDDING_LR=0.3 MATRIX_LR=0.044351174853283215 UNEMBEDDING_LR=0.0035354440460033296 WEIGHT_DECAY=0.15 WARMUP_RATIO=0.0 WARMDOWN_RATIO=0.5 FINAL_LR_FRAC=0.0 LOGITS_SOFTCAP=15.0 ZERO_O_PROJ_INIT=1
b89b9b3	2.626973	2.8	discard	gpu2 promising run1773494678 DEPTH=8 HEAD_DIM=32 ASPECT_RATIO=61 H_CYCLES=3 L_CYCLES=2 FORWARD_DTYPE=float32 PRENORM=0 LAYER_SCALE_INIT=0.0 DEVICE_BATCH_SIZE=2 TOTAL_BATCH_SIZE=65536 EMBEDDING_LR=0.3 MATRIX_LR=0.04 UNEMBEDDING_LR=0.004 WEIGHT_DECAY=0.15 WARMUP_RATIO=0.02 WARMDOWN_RATIO=0.5 FINAL_LR_FRAC=0.0 LOGITS_SOFTCAP=15.0 ZERO_O_PROJ_INIT=1
b89b9b3	2.627128	3.4	discard	gpu1 second run1773494678 DEPTH=8 HEAD_DIM=32 ASPECT_RATIO=73 H_CYCLES=2 L_CYCLES=2 FORWARD_DTYPE=bfloat16 PRENORM=0 LAYER_SCALE_INIT=0.0 DEVICE_BATCH_SIZE=2 TOTAL_BATCH_SIZE=65536 EMBEDDING_LR=0.3 MATRIX_LR=0.044351174853283215 UNEMBEDDING_LR=0.0035354440460033296 WEIGHT_DECAY=0.15 WARMUP_RATIO=0.0 WARMDOWN_RATIO=0.5 FINAL_LR_FRAC=0.0 LOGITS_SOFTCAP=15.0 ZERO_O_PROJ_INIT=1
b89b9b3	2.626691	2.7	discard	gpu0 best run1773495252 DEPTH=8 HEAD_DIM=32 ASPECT_RATIO=64 H_CYCLES=2 L_CYCLES=2 FORWARD_DTYPE=bfloat16 PRENORM=0 LAYER_SCALE_INIT=0.0 DEVICE_BATCH_SIZE=2 TOTAL_BATCH_SIZE=65536 EMBEDDING_LR=0.309082243972838 MATRIX_LR=0.044351174853283215 UNEMBEDDING_LR=0.0035354440460033296 WEIGHT_DECAY=0.15 WARMUP_RATIO=0.0 WARMDOWN_RATIO=0.5 FINAL_LR_FRAC=0.0 LOGITS_SOFTCAP=15.0 ZERO_O_PROJ_INIT=1
b89b9b3	2.626704	2.7	discard	gpu3 mix run1773495252 DEPTH=8 HEAD_DIM=32 ASPECT_RATIO=64 H_CYCLES=2 L_CYCLES=2 FORWARD_DTYPE=bfloat16 PRENORM=0 LAYER_SCALE_INIT=0.0 DEVICE_BATCH_SIZE=2 TOTAL_BATCH_SIZE=65536 EMBEDDING_LR=0.3 MATRIX_LR=0.044351174853283215 UNEMBEDDING_LR=0.0035354440460033296 WEIGHT_DECAY=0.15 WARMUP_RATIO=0.0 WARMDOWN_RATIO=0.5 FINAL_LR_FRAC=0.0 LOGITS_SOFTCAP=15.0 ZERO_O_PROJ_INIT=1
b89b9b3	2.626629	2.7	discard	gpu1 second run1773495252 DEPTH=8 HEAD_DIM=32 ASPECT_RATIO=64 H_CYCLES=2 L_CYCLES=2 FORWARD_DTYPE=bfloat16 PRENORM=0 LAYER_SCALE_INIT=0.0 DEVICE_BATCH_SIZE=2 TOTAL_BATCH_SIZE=65536 EMBEDDING_LR=0.3 MATRIX_LR=0.044351174853283215 UNEMBEDDING_LR=0.0035354440460033296 WEIGHT_DECAY=0.15 WARMUP_RATIO=0.0 WARMDOWN_RATIO=0.5 FINAL_LR_FRAC=0.0 LOGITS_SOFTCAP=15.0 ZERO_O_PROJ_INIT=1
b89b9b3	2.626956	2.8	discard	gpu2 promising run1773495252 DEPTH=8 HEAD_DIM=32 ASPECT_RATIO=61 H_CYCLES=3 L_CYCLES=2 FORWARD_DTYPE=float32 PRENORM=0 LAYER_SCALE_INIT=0.0 DEVICE_BATCH_SIZE=2 TOTAL_BATCH_SIZE=65536 EMBEDDING_LR=0.33658763927089436 MATRIX_LR=0.04 UNEMBEDDING_LR=0.004 WEIGHT_DECAY=0.15 WARMUP_RATIO=0.02 WARMDOWN_RATIO=0.5 FINAL_LR_FRAC=0.0 LOGITS_SOFTCAP=15.0 ZERO_O_PROJ_INIT=1
b89b9b3	2.626777	2.7	discard	gpu1 second run1773495853 DEPTH=8 HEAD_DIM=32 ASPECT_RATIO=64 H_CYCLES=2 L_CYCLES=2 FORWARD_DTYPE=bfloat16 PRENORM=0 LAYER_SCALE_INIT=0.0 DEVICE_BATCH_SIZE=2 TOTAL_BATCH_SIZE=65536 EMBEDDING_LR=0.309082243972838 MATRIX_LR=0.044351174853283215 UNEMBEDDING_LR=0.0035354440460033296 WEIGHT_DECAY=0.15 WARMUP_RATIO=0.0 WARMDOWN_RATIO=0.5 FINAL_LR_FRAC=0.0 LOGITS_SOFTCAP=15.0 ZERO_O_PROJ_INIT=1
b89b9b3	2.626764	2.7	discard	gpu3 mix run1773495853 DEPTH=8 HEAD_DIM=64 ASPECT_RATIO=64 H_CYCLES=2 L_CYCLES=2 FORWARD_DTYPE=bfloat16 PRENORM=0 LAYER_SCALE_INIT=0.0 DEVICE_BATCH_SIZE=2 TOTAL_BATCH_SIZE=65536 EMBEDDING_LR=0.309082243972838 MATRIX_LR=0.044351174853283215 UNEMBEDDING_LR=0.0035354440460033296 WEIGHT_DECAY=0.15 WARMUP_RATIO=0.0 WARMDOWN_RATIO=0.5 FINAL_LR_FRAC=0.0 LOGITS_SOFTCAP=15.0 ZERO_O_PROJ_INIT=1
b89b9b3	2.627034	2.8	discard	gpu2 promising run1773495853 DEPTH=8 HEAD_DIM=32 ASPECT_RATIO=61 H_CYCLES=3 L_CYCLES=2 FORWARD_DTYPE=float32 PRENORM=0 LAYER_SCALE_INIT=0.0 DEVICE_BATCH_SIZE=2 TOTAL_BATCH_SIZE=65536 EMBEDDING_LR=0.3 MATRIX_LR=0.04 UNEMBEDDING_LR=0.004 WEIGHT_DECAY=0.15 WARMUP_RATIO=0.02 WARMDOWN_RATIO=0.5 FINAL_LR_FRAC=0.0 LOGITS_SOFTCAP=15.0 ZERO_O_PROJ_INIT=1
b89b9b3	2.628384	7.0	discard	gpu0 best run1773495853 DEPTH=12 HEAD_DIM=32 ASPECT_RATIO=64 H_CYCLES=2 L_CYCLES=2 FORWARD_DTYPE=bfloat16 PRENORM=0 LAYER_SCALE_INIT=0.0 DEVICE_BATCH_SIZE=2 TOTAL_BATCH_SIZE=65536 EMBEDDING_LR=0.3 MATRIX_LR=0.044351174853283215 UNEMBEDDING_LR=0.0035354440460033296 WEIGHT_DECAY=0.15 WARMUP_RATIO=0.0 WARMDOWN_RATIO=0.5 FINAL_LR_FRAC=0.0 LOGITS_SOFTCAP=15.0 ZERO_O_PROJ_INIT=1
d1db342	2.625892	0.5	keep	20260314T153542Z_cwesj5 | Patch implements Hypothesis 2: increase model depth from 2 to 4, set head dimension to 32 (elite value), and adjust aspect ratio to 48 for balanced scaling. This aims to enhance model capacity with moderate risk, building on proven configurations.
d1db342	2.626013	0.5	discard	20260314T153542Z_cwesj5 | Patch implements Hypothesis 2: increase model depth from 2 to 4, set head dimension to 32 (elite value), and adjust aspect ratio to 48 for balanced scaling. This aims to enhance model capacity with moderate risk, building on proven configurations.
d1db342	2.625893	0.5	discard	20260314T153542Z_cwesj5 | Patch implements Hypothesis 2: increase model depth from 2 to 4, set head dimension to 32 (elite value), and adjust aspect ratio to 48 for balanced scaling. This aims to enhance model capacity with moderate risk, building on proven configurations.
d1db342	2.625923	0.5	discard	20260314T153542Z_cwesj5 | Patch implements Hypothesis 2: increase model depth from 2 to 4, set head dimension to 32 (elite value), and adjust aspect ratio to 48 for balanced scaling. This aims to enhance model capacity with moderate risk, building on proven configurations.
ce28118	2.625918	0.5	discard	20260314T160811Z_9gt3c8 | Implement Hypothesis 2: increase H_CYCLES from 2 to 3 to optimize recurrence pattern, enable PRENORM by default for improved gradient flow, and set layer scale initialization to 1e-5 for added stability. This builds incrementally on the proven elite configuration with minimal risk. | role=best | gpu=0 | seed=771916105 | parent=elite.best:d1db342
ce28118	2.625913	0.5	discard	20260314T160811Z_9gt3c8 | Implement Hypothesis 2: increase H_CYCLES from 2 to 3 to optimize recurrence pattern, enable PRENORM by default for improved gradient flow, and set layer scale initialization to 1e-5 for added stability. This builds incrementally on the proven elite configuration with minimal risk. | role=second | gpu=1 | seed=1780100072 | parent=elite.second:d1db342
ce28118	2.626758	2.7	discard	20260314T160811Z_9gt3c8 | Implement Hypothesis 2: increase H_CYCLES from 2 to 3 to optimize recurrence pattern, enable PRENORM by default for improved gradient flow, and set layer scale initialization to 1e-5 for added stability. This builds incrementally on the proven elite configuration with minimal risk. | role=mix | gpu=3 | seed=1246885917 | parent=elite.promising:b89b9b3
ce28118	2.626686	2.7	discard	20260314T160811Z_9gt3c8 | Implement Hypothesis 2: increase H_CYCLES from 2 to 3 to optimize recurrence pattern, enable PRENORM by default for improved gradient flow, and set layer scale initialization to 1e-5 for added stability. This builds incrementally on the proven elite configuration with minimal risk. | role=promising | gpu=2 | seed=599135587 | parent=elite.promising:b89b9b3
ac72c7a	2.625896	0.5	discard	20260314T162444Z_vdgni1 | Set DEPTH=6 and ASPECT_RATIO=52 to test deeper network based on Hypothesis 1, building on previous best configuration with HEAD_DIM=32. This isolates depth as the primary variable for interpretable results. | role=second | gpu=1 | seed=1534857392 | parent=elite.second:d1db342
ac72c7a	2.625932	0.5	discard	20260314T162444Z_vdgni1 | Set DEPTH=6 and ASPECT_RATIO=52 to test deeper network based on Hypothesis 1, building on previous best configuration with HEAD_DIM=32. This isolates depth as the primary variable for interpretable results. | role=best | gpu=0 | seed=1602155457 | parent=elite.best:d1db342
ac72c7a	2.626695	2.7	discard	20260314T162444Z_vdgni1 | Set DEPTH=6 and ASPECT_RATIO=52 to test deeper network based on Hypothesis 1, building on previous best configuration with HEAD_DIM=32. This isolates depth as the primary variable for interpretable results. | role=promising | gpu=2 | seed=1915597969 | parent=elite.promising:b89b9b3
ac72c7a	2.626655	2.7	discard	20260314T162444Z_vdgni1 | Set DEPTH=6 and ASPECT_RATIO=52 to test deeper network based on Hypothesis 1, building on previous best configuration with HEAD_DIM=32. This isolates depth as the primary variable for interpretable results. | role=mix | gpu=3 | seed=59380483 | parent=elite.promising:b89b9b3
cbe5f44	2.625960	0.5	discard	20260314T164949Z_y0mtp2 | Implement Hypothesis 2: Increase aspect ratio from 48 to 64 to test width scaling versus depth, using head_dim=32. This aims to improve model capacity with 33% wider layers for better parameter efficiency and representational power, based on architectural scaling trade-offs. | role=second | gpu=1 | seed=1617459651 | parent=elite.second:d1db342
cbe5f44	2.625974	0.5	discard	20260314T164949Z_y0mtp2 | Implement Hypothesis 2: Increase aspect ratio from 48 to 64 to test width scaling versus depth, using head_dim=32. This aims to improve model capacity with 33% wider layers for better parameter efficiency and representational power, based on architectural scaling trade-offs. | role=best | gpu=0 | seed=88860492 | parent=elite.best:d1db342
cbe5f44	2.626726	2.7	discard	20260314T164949Z_y0mtp2 | Implement Hypothesis 2: Increase aspect ratio from 48 to 64 to test width scaling versus depth, using head_dim=32. This aims to improve model capacity with 33% wider layers for better parameter efficiency and representational power, based on architectural scaling trade-offs. | role=promising | gpu=2 | seed=630346828 | parent=elite.promising:b89b9b3
cbe5f44	2.626739	2.7	discard	20260314T164949Z_y0mtp2 | Implement Hypothesis 2: Increase aspect ratio from 48 to 64 to test width scaling versus depth, using head_dim=32. This aims to improve model capacity with 33% wider layers for better parameter efficiency and representational power, based on architectural scaling trade-offs. | role=mix | gpu=3 | seed=627386358 | parent=elite.promising:b89b9b3
fdcbdb8	2.625874	0.5	keep	20260314T171240Z_07ep1v | Modify ASPECT_RATIO default to 64 and FORWARD_DTYPE default to 'bfloat16' to test width scaling with reduced precision, keeping depth=4, head_dim=32, H_CYCLES=2 as per elite configuration. | role=second | gpu=1 | seed=818173576 | parent=elite.second:d1db342
fdcbdb8	2.626000	0.5	discard	20260314T171240Z_07ep1v | Modify ASPECT_RATIO default to 64 and FORWARD_DTYPE default to 'bfloat16' to test width scaling with reduced precision, keeping depth=4, head_dim=32, H_CYCLES=2 as per elite configuration. | role=best | gpu=0 | seed=656458920 | parent=elite.best:d1db342
fdcbdb8	2.625898	0.5	discard	20260314T171240Z_07ep1v | Modify ASPECT_RATIO default to 64 and FORWARD_DTYPE default to 'bfloat16' to test width scaling with reduced precision, keeping depth=4, head_dim=32, H_CYCLES=2 as per elite configuration. | role=mix | gpu=3 | seed=1245503293 | parent=elite.best:d1db342
fdcbdb8	2.626744	2.7	discard	20260314T171240Z_07ep1v | Modify ASPECT_RATIO default to 64 and FORWARD_DTYPE default to 'bfloat16' to test width scaling with reduced precision, keeping depth=4, head_dim=32, H_CYCLES=2 as per elite configuration. | role=promising | gpu=2 | seed=669675679 | parent=elite.promising:b89b9b3
8a0ad98	2.625906	0.5	discard	20260314T180224Z_7p4616 | Implement modified Hypothesis 1: Increase DEPTH to 6 and adjust ASPECT_RATIO to 48 (model_dim=288) while keeping HEAD_DIM=32 and FORWARD_DTYPE='bfloat16' to balance depth-width tradeoff within VRAM constraints. | role=best | gpu=0 | seed=91891865 | parent=elite.best:fdcbdb8
8a0ad98	2.625936	0.5	discard	20260314T180224Z_7p4616 | Implement modified Hypothesis 1: Increase DEPTH to 6 and adjust ASPECT_RATIO to 48 (model_dim=288) while keeping HEAD_DIM=32 and FORWARD_DTYPE='bfloat16' to balance depth-width tradeoff within VRAM constraints. | role=second | gpu=1 | seed=1481122852 | parent=elite.second:d1db342
8a0ad98	2.626304	1.5	discard	20260314T180224Z_7p4616 | Implement modified Hypothesis 1: Increase DEPTH to 6 and adjust ASPECT_RATIO to 48 (model_dim=288) while keeping HEAD_DIM=32 and FORWARD_DTYPE='bfloat16' to balance depth-width tradeoff within VRAM constraints. | role=mix | gpu=3 | seed=195228918 | parent=elite.second:d1db342
75fadc4	2.625901	0.5	discard	20260314T182730Z_h1tnw6 | Implement Hypothesis 2: Width-focused scaling by increasing ASPECT_RATIO from 64 to 96 and setting FORWARD_DTYPE to float32, while keeping DEPTH=4, to test if increased width improves performance with lower VRAM risk. | role=best | gpu=0 | seed=1947487312 | parent=elite.best:fdcbdb8
75fadc4	2.625991	0.5	discard	20260314T182730Z_h1tnw6 | Implement Hypothesis 2: Width-focused scaling by increasing ASPECT_RATIO from 64 to 96 and setting FORWARD_DTYPE to float32, while keeping DEPTH=4, to test if increased width improves performance with lower VRAM risk. | role=second | gpu=1 | seed=1675190723 | parent=elite.second:d1db342
75fadc4	2.625983	0.5	discard	20260314T182730Z_h1tnw6 | Implement Hypothesis 2: Width-focused scaling by increasing ASPECT_RATIO from 64 to 96 and setting FORWARD_DTYPE to float32, while keeping DEPTH=4, to test if increased width improves performance with lower VRAM risk. | role=mix | gpu=3 | seed=1059564543 | parent=elite.second:d1db342
f9c969f	2.625986	0.5	discard	20260314T184027Z_d77a4i | Implement Hypothesis 1: width scaling to model dimension 256 by setting aspect ratio to 64, keeping depth=4, head_dim=32, H_CYCLES=2, L_CYCLES=2, and using bfloat16. The code already has these as default values, so no changes are needed to the source code; the configuration is already set for the hypothesis. | role=second | gpu=1 | seed=319280839 | parent=elite.second:d1db342
f9c969f	2.625945	0.5	discard	20260314T184027Z_d77a4i | Implement Hypothesis 1: width scaling to model dimension 256 by setting aspect ratio to 64, keeping depth=4, head_dim=32, H_CYCLES=2, L_CYCLES=2, and using bfloat16. The code already has these as default values, so no changes are needed to the source code; the configuration is already set for the hypothesis. | role=best | gpu=0 | seed=1306211551 | parent=elite.best:fdcbdb8
f9c969f	2.626269	2.1	discard	20260314T184027Z_d77a4i | Implement Hypothesis 1: width scaling to model dimension 256 by setting aspect ratio to 64, keeping depth=4, head_dim=32, H_CYCLES=2, L_CYCLES=2, and using bfloat16. The code already has these as default values, so no changes are needed to the source code; the configuration is already set for the hypothesis. | role=mix | gpu=3 | seed=295984476 | parent=elite.promising:8a0ad98
1c974d1	2.625949	0.5	discard	20260314T191107Z_6nz7m2 | Modify H_CYCLES and L_CYCLES defaults to 3 and 1 respectively to test optimized cycle configuration, shifting balance towards high-level cycles with minimal VRAM and stability impact. | role=best | gpu=0 | seed=587360506 | parent=elite.best:fdcbdb8
