commit	val_bpb	memory_gb	status	description
7f57dc8	0.000000	0.0	crash	baseline hrm config OOM on MPS
7026845	2.627101	2.1	keep	baseline (linux/cuda shim)
4d32d8c	2.626379	1.5	keep	gpu0 run1 DEPTH=6 HEAD_DIM=32 ASPECT_RATIO=64 H_CYCLES=2 L_CYCLES=2 FORWARD_DTYPE=bfloat16 DEVICE_BATCH_SIZE=2 TOTAL_BATCH_SIZE=65536 EMBEDDING_LR=0.3 MATRIX_LR=0.04 UNEMBEDDING_LR=0.004 WEIGHT_DECAY=0.15 WARMUP_RATIO=0.02 WARMDOWN_RATIO=0.5 FINAL_LR_FRAC=0.0 LOGITS_SOFTCAP=15.0 ZERO_O_PROJ_INIT=1
4d32d8c	2.626823	2.7	discard	gpu1 run1 DEPTH=8 HEAD_DIM=32 ASPECT_RATIO=64 H_CYCLES=2 L_CYCLES=1 FORWARD_DTYPE=bfloat16 DEVICE_BATCH_SIZE=2 TOTAL_BATCH_SIZE=65536 EMBEDDING_LR=0.3 MATRIX_LR=0.04 UNEMBEDDING_LR=0.004 WEIGHT_DECAY=0.15 WARMUP_RATIO=0.1 WARMDOWN_RATIO=0.5 FINAL_LR_FRAC=0.0 LOGITS_SOFTCAP=15.0 ZERO_O_PROJ_INIT=1
4d32d8c	2.626761	2.7	discard	gpu3 run1 DEPTH=8 HEAD_DIM=32 ASPECT_RATIO=64 H_CYCLES=2 L_CYCLES=2 FORWARD_DTYPE=bfloat16 DEVICE_BATCH_SIZE=2 TOTAL_BATCH_SIZE=65536 EMBEDDING_LR=0.3 MATRIX_LR=0.04 UNEMBEDDING_LR=0.004 WEIGHT_DECAY=0.15 WARMUP_RATIO=0.02 WARMDOWN_RATIO=0.5 FINAL_LR_FRAC=0.0 LOGITS_SOFTCAP=15.0 ZERO_O_PROJ_INIT=1
4d32d8c	2.626775	2.7	discard	gpu2 run1 DEPTH=8 HEAD_DIM=32 ASPECT_RATIO=64 H_CYCLES=2 L_CYCLES=2 FORWARD_DTYPE=bfloat16 DEVICE_BATCH_SIZE=2 TOTAL_BATCH_SIZE=65536 EMBEDDING_LR=0.3 MATRIX_LR=0.04 UNEMBEDDING_LR=0.004 WEIGHT_DECAY=0.15 WARMUP_RATIO=0.02 WARMDOWN_RATIO=0.5 FINAL_LR_FRAC=0.0 LOGITS_SOFTCAP=15.0 ZERO_O_PROJ_INIT=1
4d32d8c	2.626426	1.5	discard	gpu0 run2 DEPTH=6 HEAD_DIM=32 ASPECT_RATIO=64 H_CYCLES=2 L_CYCLES=2 FORWARD_DTYPE=bfloat16 DEVICE_BATCH_SIZE=2 TOTAL_BATCH_SIZE=65536 EMBEDDING_LR=0.3 MATRIX_LR=0.04 UNEMBEDDING_LR=0.004 WEIGHT_DECAY=0.15 WARMUP_RATIO=0.02 WARMDOWN_RATIO=0.5 FINAL_LR_FRAC=0.0 LOGITS_SOFTCAP=0.0 ZERO_O_PROJ_INIT=1
4d32d8c	2.626305	1.5	keep	gpu1 run2 DEPTH=6 HEAD_DIM=32 ASPECT_RATIO=64 H_CYCLES=2 L_CYCLES=2 FORWARD_DTYPE=bfloat16 DEVICE_BATCH_SIZE=2 TOTAL_BATCH_SIZE=65536 EMBEDDING_LR=0.3 MATRIX_LR=0.04 UNEMBEDDING_LR=0.004 WEIGHT_DECAY=0.15 WARMUP_RATIO=0.02 WARMDOWN_RATIO=0.5 FINAL_LR_FRAC=0.0 LOGITS_SOFTCAP=0.0 ZERO_O_PROJ_INIT=1
4d32d8c	2.626575	1.5	discard	gpu3 run2 DEPTH=6 HEAD_DIM=32 ASPECT_RATIO=64 H_CYCLES=2 L_CYCLES=2 FORWARD_DTYPE=bfloat16 DEVICE_BATCH_SIZE=2 TOTAL_BATCH_SIZE=65536 EMBEDDING_LR=0.3 MATRIX_LR=0.04 UNEMBEDDING_LR=0.004 WEIGHT_DECAY=0.15 WARMUP_RATIO=0.02 WARMDOWN_RATIO=0.3 FINAL_LR_FRAC=0.0 LOGITS_SOFTCAP=15.0 ZERO_O_PROJ_INIT=1
4d32d8c	2.626407	1.6	discard	gpu2 run2 DEPTH=6 HEAD_DIM=32 ASPECT_RATIO=65 H_CYCLES=2 L_CYCLES=2 FORWARD_DTYPE=bfloat16 DEVICE_BATCH_SIZE=2 TOTAL_BATCH_SIZE=65536 EMBEDDING_LR=0.3 MATRIX_LR=0.04 UNEMBEDDING_LR=0.004 WEIGHT_DECAY=0.15 WARMUP_RATIO=0.02 WARMDOWN_RATIO=0.5 FINAL_LR_FRAC=0.0 LOGITS_SOFTCAP=15.0 ZERO_O_PROJ_INIT=1
4d32d8c	2.626147	1.5	keep	gpu0 run3 DEPTH=6 HEAD_DIM=32 ASPECT_RATIO=64 H_CYCLES=1 L_CYCLES=2 FORWARD_DTYPE=bfloat16 DEVICE_BATCH_SIZE=2 TOTAL_BATCH_SIZE=65536 EMBEDDING_LR=0.3 MATRIX_LR=0.04 UNEMBEDDING_LR=0.004 WEIGHT_DECAY=0.15 WARMUP_RATIO=0.02 WARMDOWN_RATIO=0.5 FINAL_LR_FRAC=0.0 LOGITS_SOFTCAP=15.0 ZERO_O_PROJ_INIT=1
4d32d8c	2.626338	1.5	discard	gpu1 run3 DEPTH=6 HEAD_DIM=32 ASPECT_RATIO=64 H_CYCLES=2 L_CYCLES=2 FORWARD_DTYPE=bfloat16 DEVICE_BATCH_SIZE=2 TOTAL_BATCH_SIZE=65536 EMBEDDING_LR=0.3316507067710837 MATRIX_LR=0.04 UNEMBEDDING_LR=0.004 WEIGHT_DECAY=0.15 WARMUP_RATIO=0.02 WARMDOWN_RATIO=0.5 FINAL_LR_FRAC=0.0 LOGITS_SOFTCAP=0.0 ZERO_O_PROJ_INIT=1
4d32d8c	2.626354	1.5	discard	gpu3 run3 DEPTH=6 HEAD_DIM=32 ASPECT_RATIO=64 H_CYCLES=2 L_CYCLES=2 FORWARD_DTYPE=bfloat16 DEVICE_BATCH_SIZE=2 TOTAL_BATCH_SIZE=65536 EMBEDDING_LR=0.3 MATRIX_LR=0.04 UNEMBEDDING_LR=0.004 WEIGHT_DECAY=0.15 WARMUP_RATIO=0.02 WARMDOWN_RATIO=0.5 FINAL_LR_FRAC=0.0 LOGITS_SOFTCAP=0.0 ZERO_O_PROJ_INIT=1
4d32d8c	2.626345	1.5	discard	gpu2 run3 DEPTH=6 HEAD_DIM=32 ASPECT_RATIO=64 H_CYCLES=2 L_CYCLES=2 FORWARD_DTYPE=bfloat16 DEVICE_BATCH_SIZE=2 TOTAL_BATCH_SIZE=65536 EMBEDDING_LR=0.3 MATRIX_LR=0.04 UNEMBEDDING_LR=0.004 WEIGHT_DECAY=0.15 WARMUP_RATIO=0.02 WARMDOWN_RATIO=0.5 FINAL_LR_FRAC=0.0 LOGITS_SOFTCAP=0.0 ZERO_O_PROJ_INIT=1
4d32d8c	2.626277	1.8	discard	gpu1 run4 DEPTH=6 HEAD_DIM=32 ASPECT_RATIO=74 H_CYCLES=1 L_CYCLES=2 FORWARD_DTYPE=bfloat16 DEVICE_BATCH_SIZE=2 TOTAL_BATCH_SIZE=65536 EMBEDDING_LR=0.3 MATRIX_LR=0.04 UNEMBEDDING_LR=0.004 WEIGHT_DECAY=0.15 WARMUP_RATIO=0.02 WARMDOWN_RATIO=0.5 FINAL_LR_FRAC=0.0 LOGITS_SOFTCAP=15.0 ZERO_O_PROJ_INIT=1
4d32d8c	2.626065	1.5	keep	gpu2 run4 DEPTH=6 HEAD_DIM=32 ASPECT_RATIO=64 H_CYCLES=1 L_CYCLES=1 FORWARD_DTYPE=bfloat16 DEVICE_BATCH_SIZE=2 TOTAL_BATCH_SIZE=65536 EMBEDDING_LR=0.22994567607363237 MATRIX_LR=0.04 UNEMBEDDING_LR=0.004 WEIGHT_DECAY=0.15 WARMUP_RATIO=0.02 WARMDOWN_RATIO=0.5 FINAL_LR_FRAC=0.0 LOGITS_SOFTCAP=15.0 ZERO_O_PROJ_INIT=1
4d32d8c	2.626648	2.7	discard	gpu3 run4 DEPTH=8 HEAD_DIM=32 ASPECT_RATIO=64 H_CYCLES=1 L_CYCLES=2 FORWARD_DTYPE=bfloat16 DEVICE_BATCH_SIZE=2 TOTAL_BATCH_SIZE=65536 EMBEDDING_LR=0.3 MATRIX_LR=0.04 UNEMBEDDING_LR=0.004 WEIGHT_DECAY=0.15 WARMUP_RATIO=0.02 WARMDOWN_RATIO=0.5 FINAL_LR_FRAC=0.0 LOGITS_SOFTCAP=15.0 ZERO_O_PROJ_INIT=1
4d32d8c	2.626451	1.5	discard	gpu0 run4 DEPTH=6 HEAD_DIM=32 ASPECT_RATIO=64 H_CYCLES=3 L_CYCLES=2 FORWARD_DTYPE=bfloat16 DEVICE_BATCH_SIZE=2 TOTAL_BATCH_SIZE=65536 EMBEDDING_LR=0.3 MATRIX_LR=0.04 UNEMBEDDING_LR=0.004 WEIGHT_DECAY=0.15 WARMUP_RATIO=0.02 WARMDOWN_RATIO=0.5 FINAL_LR_FRAC=0.0 LOGITS_SOFTCAP=15.0 ZERO_O_PROJ_INIT=1
4d32d8c	2.626146	1.5	discard	gpu1 run5 DEPTH=6 HEAD_DIM=32 ASPECT_RATIO=64 H_CYCLES=1 L_CYCLES=2 FORWARD_DTYPE=bfloat16 DEVICE_BATCH_SIZE=2 TOTAL_BATCH_SIZE=65536 EMBEDDING_LR=0.3 MATRIX_LR=0.04 UNEMBEDDING_LR=0.004 WEIGHT_DECAY=0.15 WARMUP_RATIO=0.02 WARMDOWN_RATIO=0.5 FINAL_LR_FRAC=0.0 LOGITS_SOFTCAP=15.0 ZERO_O_PROJ_INIT=1
4d32d8c	2.626086	1.5	discard	gpu3 run5 DEPTH=6 HEAD_DIM=32 ASPECT_RATIO=64 H_CYCLES=1 L_CYCLES=1 FORWARD_DTYPE=bfloat16 DEVICE_BATCH_SIZE=2 TOTAL_BATCH_SIZE=65536 EMBEDDING_LR=0.22994567607363237 MATRIX_LR=0.04 UNEMBEDDING_LR=0.004 WEIGHT_DECAY=0.15 WARMUP_RATIO=0.02 WARMDOWN_RATIO=0.5 FINAL_LR_FRAC=0.0 LOGITS_SOFTCAP=15.0 ZERO_O_PROJ_INIT=1
4d32d8c	2.626079	1.5	discard	gpu0 run5 DEPTH=6 HEAD_DIM=32 ASPECT_RATIO=64 H_CYCLES=1 L_CYCLES=1 FORWARD_DTYPE=bfloat16 DEVICE_BATCH_SIZE=2 TOTAL_BATCH_SIZE=65536 EMBEDDING_LR=0.22994567607363237 MATRIX_LR=0.04 UNEMBEDDING_LR=0.004 WEIGHT_DECAY=0.15 WARMUP_RATIO=0.02 WARMDOWN_RATIO=0.5 FINAL_LR_FRAC=0.0 LOGITS_SOFTCAP=15.0 ZERO_O_PROJ_INIT=1
4d32d8c	2.626259	1.5	discard	gpu2 run5 DEPTH=6 HEAD_DIM=32 ASPECT_RATIO=64 H_CYCLES=2 L_CYCLES=1 FORWARD_DTYPE=bfloat16 DEVICE_BATCH_SIZE=2 TOTAL_BATCH_SIZE=65536 EMBEDDING_LR=0.22994567607363237 MATRIX_LR=0.04 UNEMBEDDING_LR=0.004 WEIGHT_DECAY=0.15 WARMUP_RATIO=0.02 WARMDOWN_RATIO=0.5 FINAL_LR_FRAC=0.0 LOGITS_SOFTCAP=15.0 ZERO_O_PROJ_INIT=1
4d32d8c	2.626230	1.5	discard	gpu1 run6 DEPTH=6 HEAD_DIM=32 ASPECT_RATIO=64 H_CYCLES=1 L_CYCLES=1 FORWARD_DTYPE=bfloat16 DEVICE_BATCH_SIZE=2 TOTAL_BATCH_SIZE=65536 EMBEDDING_LR=0.22994567607363237 MATRIX_LR=0.04 UNEMBEDDING_LR=0.004 WEIGHT_DECAY=0.15 WARMUP_RATIO=0.02 WARMDOWN_RATIO=0.3 FINAL_LR_FRAC=0.0 LOGITS_SOFTCAP=15.0 ZERO_O_PROJ_INIT=1
4d32d8c	2.626063	1.5	keep	gpu3 run6 DEPTH=6 HEAD_DIM=32 ASPECT_RATIO=64 H_CYCLES=1 L_CYCLES=1 FORWARD_DTYPE=bfloat16 DEVICE_BATCH_SIZE=2 TOTAL_BATCH_SIZE=65536 EMBEDDING_LR=0.22994567607363237 MATRIX_LR=0.04 UNEMBEDDING_LR=0.004 WEIGHT_DECAY=0.1243392359021272 WARMUP_RATIO=0.02 WARMDOWN_RATIO=0.5 FINAL_LR_FRAC=0.0 LOGITS_SOFTCAP=15.0 ZERO_O_PROJ_INIT=1
4d32d8c	2.626196	1.5	discard	gpu0 run6 DEPTH=6 HEAD_DIM=32 ASPECT_RATIO=64 H_CYCLES=1 L_CYCLES=1 FORWARD_DTYPE=bfloat16 DEVICE_BATCH_SIZE=2 TOTAL_BATCH_SIZE=65536 EMBEDDING_LR=0.22994567607363237 MATRIX_LR=0.04 UNEMBEDDING_LR=0.004 WEIGHT_DECAY=0.15 WARMUP_RATIO=0.02 WARMDOWN_RATIO=0.3 FINAL_LR_FRAC=0.0 LOGITS_SOFTCAP=15.0 ZERO_O_PROJ_INIT=1
4d32d8c	2.626134	1.5	discard	gpu2 run6 DEPTH=6 HEAD_DIM=32 ASPECT_RATIO=64 H_CYCLES=1 L_CYCLES=1 FORWARD_DTYPE=bfloat16 DEVICE_BATCH_SIZE=2 TOTAL_BATCH_SIZE=65536 EMBEDDING_LR=0.22994567607363237 MATRIX_LR=0.04 UNEMBEDDING_LR=0.004 WEIGHT_DECAY=0.18274688317742974 WARMUP_RATIO=0.02 WARMDOWN_RATIO=0.5 FINAL_LR_FRAC=0.0 LOGITS_SOFTCAP=15.0 ZERO_O_PROJ_INIT=1
4d32d8c	2.626163	1.5	discard	gpu1 run7 DEPTH=6 HEAD_DIM=32 ASPECT_RATIO=64 H_CYCLES=1 L_CYCLES=1 FORWARD_DTYPE=bfloat16 DEVICE_BATCH_SIZE=2 TOTAL_BATCH_SIZE=65536 EMBEDDING_LR=0.22994567607363237 MATRIX_LR=0.04 UNEMBEDDING_LR=0.004 WEIGHT_DECAY=0.15 WARMUP_RATIO=0.02 WARMDOWN_RATIO=0.5 FINAL_LR_FRAC=0.0 LOGITS_SOFTCAP=15.0 ZERO_O_PROJ_INIT=1
4d32d8c	2.626106	1.5	discard	gpu0 run7 DEPTH=6 HEAD_DIM=32 ASPECT_RATIO=64 H_CYCLES=1 L_CYCLES=1 FORWARD_DTYPE=bfloat16 DEVICE_BATCH_SIZE=2 TOTAL_BATCH_SIZE=65536 EMBEDDING_LR=0.22138993197357207 MATRIX_LR=0.04 UNEMBEDDING_LR=0.004 WEIGHT_DECAY=0.1243392359021272 WARMUP_RATIO=0.02 WARMDOWN_RATIO=0.5 FINAL_LR_FRAC=0.0 LOGITS_SOFTCAP=15.0 ZERO_O_PROJ_INIT=1
4d32d8c	2.626084	1.5	discard	gpu2 run7 DEPTH=6 HEAD_DIM=32 ASPECT_RATIO=64 H_CYCLES=1 L_CYCLES=1 FORWARD_DTYPE=bfloat16 DEVICE_BATCH_SIZE=2 TOTAL_BATCH_SIZE=65536 EMBEDDING_LR=0.22994567607363237 MATRIX_LR=0.04 UNEMBEDDING_LR=0.004 WEIGHT_DECAY=0.1243392359021272 WARMUP_RATIO=0.02 WARMDOWN_RATIO=0.5 FINAL_LR_FRAC=0.0 LOGITS_SOFTCAP=15.0 ZERO_O_PROJ_INIT=1
4d32d8c	2.626568	2.7	discard	gpu3 run7 DEPTH=8 HEAD_DIM=32 ASPECT_RATIO=64 H_CYCLES=1 L_CYCLES=1 FORWARD_DTYPE=bfloat16 DEVICE_BATCH_SIZE=2 TOTAL_BATCH_SIZE=65536 EMBEDDING_LR=0.22994567607363237 MATRIX_LR=0.04 UNEMBEDDING_LR=0.004 WEIGHT_DECAY=0.1243392359021272 WARMUP_RATIO=0.02 WARMDOWN_RATIO=0.5 FINAL_LR_FRAC=0.0 LOGITS_SOFTCAP=15.0 ZERO_O_PROJ_INIT=1
4d32d8c	2.626341	1.5	discard	gpu1 run8 DEPTH=6 HEAD_DIM=32 ASPECT_RATIO=64 H_CYCLES=1 L_CYCLES=1 FORWARD_DTYPE=bfloat16 DEVICE_BATCH_SIZE=2 TOTAL_BATCH_SIZE=32768 EMBEDDING_LR=0.22994567607363237 MATRIX_LR=0.04 UNEMBEDDING_LR=0.004 WEIGHT_DECAY=0.1243392359021272 WARMUP_RATIO=0.02 WARMDOWN_RATIO=0.5 FINAL_LR_FRAC=0.0 LOGITS_SOFTCAP=15.0 ZERO_O_PROJ_INIT=1
4d32d8c	2.626185	1.5	discard	gpu0 run8 DEPTH=6 HEAD_DIM=32 ASPECT_RATIO=64 H_CYCLES=2 L_CYCLES=1 FORWARD_DTYPE=bfloat16 DEVICE_BATCH_SIZE=2 TOTAL_BATCH_SIZE=65536 EMBEDDING_LR=0.22994567607363237 MATRIX_LR=0.04 UNEMBEDDING_LR=0.004 WEIGHT_DECAY=0.1243392359021272 WARMUP_RATIO=0.02 WARMDOWN_RATIO=0.5 FINAL_LR_FRAC=0.0 LOGITS_SOFTCAP=15.0 ZERO_O_PROJ_INIT=1
4d32d8c	2.626199	1.5	discard	gpu2 run8 DEPTH=6 HEAD_DIM=32 ASPECT_RATIO=63 H_CYCLES=1 L_CYCLES=1 FORWARD_DTYPE=bfloat16 DEVICE_BATCH_SIZE=2 TOTAL_BATCH_SIZE=65536 EMBEDDING_LR=0.22994567607363237 MATRIX_LR=0.04 UNEMBEDDING_LR=0.004 WEIGHT_DECAY=0.1243392359021272 WARMUP_RATIO=0.02 WARMDOWN_RATIO=0.5 FINAL_LR_FRAC=0.0 LOGITS_SOFTCAP=15.0 ZERO_O_PROJ_INIT=1
4d32d8c	2.626269	1.5	discard	gpu3 run8 DEPTH=6 HEAD_DIM=32 ASPECT_RATIO=64 H_CYCLES=1 L_CYCLES=3 FORWARD_DTYPE=bfloat16 DEVICE_BATCH_SIZE=2 TOTAL_BATCH_SIZE=65536 EMBEDDING_LR=0.22994567607363237 MATRIX_LR=0.04 UNEMBEDDING_LR=0.004 WEIGHT_DECAY=0.1243392359021272 WARMUP_RATIO=0.02 WARMDOWN_RATIO=0.5 FINAL_LR_FRAC=0.0 LOGITS_SOFTCAP=15.0 ZERO_O_PROJ_INIT=1
4d32d8c	2.626116	1.5	discard	gpu1 run9 DEPTH=6 HEAD_DIM=32 ASPECT_RATIO=64 H_CYCLES=1 L_CYCLES=1 FORWARD_DTYPE=bfloat16 DEVICE_BATCH_SIZE=2 TOTAL_BATCH_SIZE=65536 EMBEDDING_LR=0.22994567607363237 MATRIX_LR=0.04 UNEMBEDDING_LR=0.004 WEIGHT_DECAY=0.1243392359021272 WARMUP_RATIO=0.02 WARMDOWN_RATIO=0.5 FINAL_LR_FRAC=0.0 LOGITS_SOFTCAP=15.0 ZERO_O_PROJ_INIT=0
4d32d8c	2.626123	1.5	discard	gpu0 run9 DEPTH=6 HEAD_DIM=32 ASPECT_RATIO=64 H_CYCLES=1 L_CYCLES=1 FORWARD_DTYPE=bfloat16 DEVICE_BATCH_SIZE=2 TOTAL_BATCH_SIZE=65536 EMBEDDING_LR=0.22994567607363237 MATRIX_LR=0.04 UNEMBEDDING_LR=0.00362597324974593 WEIGHT_DECAY=0.1243392359021272 WARMUP_RATIO=0.02 WARMDOWN_RATIO=0.5 FINAL_LR_FRAC=0.0 LOGITS_SOFTCAP=15.0 ZERO_O_PROJ_INIT=1
4d32d8c	2.626066	1.5	discard	gpu2 run9 DEPTH=6 HEAD_DIM=32 ASPECT_RATIO=64 H_CYCLES=1 L_CYCLES=1 FORWARD_DTYPE=bfloat16 DEVICE_BATCH_SIZE=2 TOTAL_BATCH_SIZE=65536 EMBEDDING_LR=0.22994567607363237 MATRIX_LR=0.04 UNEMBEDDING_LR=0.004 WEIGHT_DECAY=0.1243392359021272 WARMUP_RATIO=0.02 WARMDOWN_RATIO=0.5 FINAL_LR_FRAC=0.0 LOGITS_SOFTCAP=15.0 ZERO_O_PROJ_INIT=1
4d32d8c	2.626231	1.5	discard	gpu3 run9 DEPTH=6 HEAD_DIM=32 ASPECT_RATIO=64 H_CYCLES=1 L_CYCLES=1 FORWARD_DTYPE=bfloat16 DEVICE_BATCH_SIZE=2 TOTAL_BATCH_SIZE=65536 EMBEDDING_LR=0.22994567607363237 MATRIX_LR=0.04 UNEMBEDDING_LR=0.004 WEIGHT_DECAY=0.1243392359021272 WARMUP_RATIO=0.02 WARMDOWN_RATIO=0.3 FINAL_LR_FRAC=0.0 LOGITS_SOFTCAP=15.0 ZERO_O_PROJ_INIT=1
4d32d8c	2.626164	1.5	discard	gpu1 run10 DEPTH=6 HEAD_DIM=32 ASPECT_RATIO=64 H_CYCLES=1 L_CYCLES=1 FORWARD_DTYPE=bfloat16 DEVICE_BATCH_SIZE=2 TOTAL_BATCH_SIZE=65536 EMBEDDING_LR=0.22994567607363237 MATRIX_LR=0.04 UNEMBEDDING_LR=0.004 WEIGHT_DECAY=0.10937980106416394 WARMUP_RATIO=0.02 WARMDOWN_RATIO=0.5 FINAL_LR_FRAC=0.0 LOGITS_SOFTCAP=15.0 ZERO_O_PROJ_INIT=1
4d32d8c	2.626718	1.5	discard	gpu0 run10 DEPTH=6 HEAD_DIM=32 ASPECT_RATIO=64 H_CYCLES=1 L_CYCLES=1 FORWARD_DTYPE=bfloat16 DEVICE_BATCH_SIZE=2 TOTAL_BATCH_SIZE=16384 EMBEDDING_LR=0.22994567607363237 MATRIX_LR=0.04 UNEMBEDDING_LR=0.0055106789504153365 WEIGHT_DECAY=0.1243392359021272 WARMUP_RATIO=0.02 WARMDOWN_RATIO=0.5 FINAL_LR_FRAC=0.0 LOGITS_SOFTCAP=15.0 ZERO_O_PROJ_INIT=1
4d32d8c	2.626097	1.5	discard	gpu2 run10 DEPTH=6 HEAD_DIM=32 ASPECT_RATIO=64 H_CYCLES=1 L_CYCLES=1 FORWARD_DTYPE=bfloat16 DEVICE_BATCH_SIZE=2 TOTAL_BATCH_SIZE=65536 EMBEDDING_LR=0.22994567607363237 MATRIX_LR=0.04 UNEMBEDDING_LR=0.004 WEIGHT_DECAY=0.1243392359021272 WARMUP_RATIO=0.02 WARMDOWN_RATIO=0.5 FINAL_LR_FRAC=0.0 LOGITS_SOFTCAP=15.0 ZERO_O_PROJ_INIT=1
4d32d8c	2.626092	1.5	discard	gpu3 run10 DEPTH=6 HEAD_DIM=32 ASPECT_RATIO=64 H_CYCLES=1 L_CYCLES=1 FORWARD_DTYPE=bfloat16 DEVICE_BATCH_SIZE=2 TOTAL_BATCH_SIZE=65536 EMBEDDING_LR=0.22994567607363237 MATRIX_LR=0.04 UNEMBEDDING_LR=0.004 WEIGHT_DECAY=0.1243392359021272 WARMUP_RATIO=0.02 WARMDOWN_RATIO=0.5 FINAL_LR_FRAC=0.0 LOGITS_SOFTCAP=15.0 ZERO_O_PROJ_INIT=1
4d32d8c	2.626236	1.5	discard	gpu1 run11 DEPTH=6 HEAD_DIM=32 ASPECT_RATIO=64 H_CYCLES=1 L_CYCLES=3 FORWARD_DTYPE=bfloat16 DEVICE_BATCH_SIZE=2 TOTAL_BATCH_SIZE=65536 EMBEDDING_LR=0.22994567607363237 MATRIX_LR=0.04 UNEMBEDDING_LR=0.004 WEIGHT_DECAY=0.1243392359021272 WARMUP_RATIO=0.02 WARMDOWN_RATIO=0.5 FINAL_LR_FRAC=0.0 LOGITS_SOFTCAP=15.0 ZERO_O_PROJ_INIT=1
4d32d8c	2.626061	1.5	keep	gpu0 run11 DEPTH=6 HEAD_DIM=32 ASPECT_RATIO=64 H_CYCLES=1 L_CYCLES=1 FORWARD_DTYPE=bfloat16 DEVICE_BATCH_SIZE=2 TOTAL_BATCH_SIZE=65536 EMBEDDING_LR=0.22994567607363237 MATRIX_LR=0.04 UNEMBEDDING_LR=0.0035689874844954694 WEIGHT_DECAY=0.1243392359021272 WARMUP_RATIO=0.02 WARMDOWN_RATIO=0.5 FINAL_LR_FRAC=0.0 LOGITS_SOFTCAP=15.0 ZERO_O_PROJ_INIT=1
4d32d8c	2.626093	1.5	discard	gpu2 run11 DEPTH=6 HEAD_DIM=32 ASPECT_RATIO=64 H_CYCLES=1 L_CYCLES=1 FORWARD_DTYPE=bfloat16 DEVICE_BATCH_SIZE=2 TOTAL_BATCH_SIZE=65536 EMBEDDING_LR=0.22994567607363237 MATRIX_LR=0.03322828252365386 UNEMBEDDING_LR=0.004 WEIGHT_DECAY=0.1243392359021272 WARMUP_RATIO=0.02 WARMDOWN_RATIO=0.5 FINAL_LR_FRAC=0.0 LOGITS_SOFTCAP=15.0 ZERO_O_PROJ_INIT=1
4d32d8c	2.626119	1.5	discard	gpu3 run11 DEPTH=6 HEAD_DIM=32 ASPECT_RATIO=64 H_CYCLES=1 L_CYCLES=1 FORWARD_DTYPE=bfloat16 DEVICE_BATCH_SIZE=2 TOTAL_BATCH_SIZE=65536 EMBEDDING_LR=0.22994567607363237 MATRIX_LR=0.04 UNEMBEDDING_LR=0.004 WEIGHT_DECAY=0.10144832109494163 WARMUP_RATIO=0.02 WARMDOWN_RATIO=0.5 FINAL_LR_FRAC=0.0 LOGITS_SOFTCAP=15.0 ZERO_O_PROJ_INIT=1
4d32d8c	2.626205	1.5	discard	gpu1 run12 DEPTH=6 HEAD_DIM=32 ASPECT_RATIO=64 H_CYCLES=1 L_CYCLES=1 FORWARD_DTYPE=bfloat16 DEVICE_BATCH_SIZE=2 TOTAL_BATCH_SIZE=65536 EMBEDDING_LR=0.22994567607363237 MATRIX_LR=0.04 UNEMBEDDING_LR=0.004 WEIGHT_DECAY=0.1243392359021272 WARMUP_RATIO=0.02 WARMDOWN_RATIO=0.3 FINAL_LR_FRAC=0.0 LOGITS_SOFTCAP=15.0 ZERO_O_PROJ_INIT=0
4d32d8c	2.626085	1.5	discard	gpu0 run12 DEPTH=6 HEAD_DIM=32 ASPECT_RATIO=64 H_CYCLES=1 L_CYCLES=1 FORWARD_DTYPE=bfloat16 DEVICE_BATCH_SIZE=2 TOTAL_BATCH_SIZE=65536 EMBEDDING_LR=0.22994567607363237 MATRIX_LR=0.04 UNEMBEDDING_LR=0.0036242728659238313 WEIGHT_DECAY=0.1243392359021272 WARMUP_RATIO=0.02 WARMDOWN_RATIO=0.5 FINAL_LR_FRAC=0.0 LOGITS_SOFTCAP=15.0 ZERO_O_PROJ_INIT=1
4d32d8c	2.626111	1.0	discard	gpu3 run12 DEPTH=6 HEAD_DIM=32 ASPECT_RATIO=60 H_CYCLES=1 L_CYCLES=1 FORWARD_DTYPE=bfloat16 DEVICE_BATCH_SIZE=1 TOTAL_BATCH_SIZE=65536 EMBEDDING_LR=0.22994567607363237 MATRIX_LR=0.04 UNEMBEDDING_LR=0.0035689874844954694 WEIGHT_DECAY=0.1243392359021272 WARMUP_RATIO=0.02 WARMDOWN_RATIO=0.5 FINAL_LR_FRAC=0.0 LOGITS_SOFTCAP=15.0 ZERO_O_PROJ_INIT=1
4d32d8c	2.626348	1.5	discard	gpu2 run12 DEPTH=6 HEAD_DIM=32 ASPECT_RATIO=64 H_CYCLES=3 L_CYCLES=1 FORWARD_DTYPE=bfloat16 DEVICE_BATCH_SIZE=2 TOTAL_BATCH_SIZE=65536 EMBEDDING_LR=0.22994567607363237 MATRIX_LR=0.04 UNEMBEDDING_LR=0.0035689874844954694 WEIGHT_DECAY=0.1243392359021272 WARMUP_RATIO=0.02 WARMDOWN_RATIO=0.5 FINAL_LR_FRAC=0.0 LOGITS_SOFTCAP=15.0 ZERO_O_PROJ_INIT=1
4d32d8c	2.626611	2.7	discard	gpu1 run13 DEPTH=8 HEAD_DIM=32 ASPECT_RATIO=64 H_CYCLES=1 L_CYCLES=1 FORWARD_DTYPE=bfloat16 DEVICE_BATCH_SIZE=2 TOTAL_BATCH_SIZE=65536 EMBEDDING_LR=0.22994567607363237 MATRIX_LR=0.04 UNEMBEDDING_LR=0.0035689874844954694 WEIGHT_DECAY=0.1243392359021272 WARMUP_RATIO=0.02 WARMDOWN_RATIO=0.5 FINAL_LR_FRAC=0.0 LOGITS_SOFTCAP=15.0 ZERO_O_PROJ_INIT=1
68906f1	2.626701	2.7	discard	gpu2 promising run1 DEPTH=8 HEAD_DIM=32 ASPECT_RATIO=64 H_CYCLES=2 L_CYCLES=2 FORWARD_DTYPE=bfloat16 DEVICE_BATCH_SIZE=2 TOTAL_BATCH_SIZE=65536 EMBEDDING_LR=0.3 MATRIX_LR=0.04 UNEMBEDDING_LR=0.004 WEIGHT_DECAY=0.15 WARMUP_RATIO=0.0 WARMDOWN_RATIO=0.5 FINAL_LR_FRAC=0.0 LOGITS_SOFTCAP=15.0 ZERO_O_PROJ_INIT=1
68906f1	2.626767	2.7	discard	gpu3 mix run1 DEPTH=8 HEAD_DIM=32 ASPECT_RATIO=64 H_CYCLES=2 L_CYCLES=2 FORWARD_DTYPE=bfloat16 DEVICE_BATCH_SIZE=2 TOTAL_BATCH_SIZE=65536 EMBEDDING_LR=0.3 MATRIX_LR=0.04 UNEMBEDDING_LR=0.004 WEIGHT_DECAY=0.15 WARMUP_RATIO=0.05 WARMDOWN_RATIO=0.5 FINAL_LR_FRAC=0.0 LOGITS_SOFTCAP=15.0 ZERO_O_PROJ_INIT=1
68906f1	2.626696	2.7	discard	gpu1 second run1 DEPTH=8 HEAD_DIM=32 ASPECT_RATIO=64 H_CYCLES=2 L_CYCLES=2 FORWARD_DTYPE=bfloat16 DEVICE_BATCH_SIZE=2 TOTAL_BATCH_SIZE=65536 EMBEDDING_LR=0.3 MATRIX_LR=0.04 UNEMBEDDING_LR=0.004 WEIGHT_DECAY=0.15 WARMUP_RATIO=0.02 WARMDOWN_RATIO=0.5 FINAL_LR_FRAC=0.0 LOGITS_SOFTCAP=15.0 ZERO_O_PROJ_INIT=1
68906f1	2.626855	2.7	discard	gpu0 best run1 DEPTH=8 HEAD_DIM=32 ASPECT_RATIO=64 H_CYCLES=2 L_CYCLES=2 FORWARD_DTYPE=bfloat16 DEVICE_BATCH_SIZE=2 TOTAL_BATCH_SIZE=65536 EMBEDDING_LR=0.3 MATRIX_LR=0.04 UNEMBEDDING_LR=0.004 WEIGHT_DECAY=0.15 WARMUP_RATIO=0.02 WARMDOWN_RATIO=0.5 FINAL_LR_FRAC=0.0 LOGITS_SOFTCAP=15.0 ZERO_O_PROJ_INIT=1
b89b9b3	2.626691	2.7	discard	gpu3 mix run1773491119 DEPTH=8 HEAD_DIM=32 ASPECT_RATIO=64 H_CYCLES=2 L_CYCLES=2 FORWARD_DTYPE=bfloat16 PRENORM=0 LAYER_SCALE_INIT=0.0 DEVICE_BATCH_SIZE=2 TOTAL_BATCH_SIZE=65536 EMBEDDING_LR=0.3 MATRIX_LR=0.044351174853283215 UNEMBEDDING_LR=0.004 WEIGHT_DECAY=0.15 WARMUP_RATIO=0.0 WARMDOWN_RATIO=0.5 FINAL_LR_FRAC=0.0 LOGITS_SOFTCAP=15.0 ZERO_O_PROJ_INIT=1
b89b9b3	2.626756	2.7	discard	gpu2 promising run1773491119 DEPTH=8 HEAD_DIM=32 ASPECT_RATIO=64 H_CYCLES=2 L_CYCLES=2 FORWARD_DTYPE=bfloat16 PRENORM=0 LAYER_SCALE_INIT=0.0 DEVICE_BATCH_SIZE=2 TOTAL_BATCH_SIZE=65536 EMBEDDING_LR=0.3 MATRIX_LR=0.04 UNEMBEDDING_LR=0.004 WEIGHT_DECAY=0.15 WARMUP_RATIO=0.02 WARMDOWN_RATIO=0.5 FINAL_LR_FRAC=0.0 LOGITS_SOFTCAP=15.0 ZERO_O_PROJ_INIT=1
b89b9b3	2.626913	2.0	discard	gpu1 second run1773491119 DEPTH=8 HEAD_DIM=32 ASPECT_RATIO=64 H_CYCLES=2 L_CYCLES=2 FORWARD_DTYPE=bfloat16 PRENORM=0 LAYER_SCALE_INIT=0.0 DEVICE_BATCH_SIZE=1 TOTAL_BATCH_SIZE=65536 EMBEDDING_LR=0.3 MATRIX_LR=0.04 UNEMBEDDING_LR=0.004 WEIGHT_DECAY=0.15 WARMUP_RATIO=0.0 WARMDOWN_RATIO=0.5 FINAL_LR_FRAC=0.0 LOGITS_SOFTCAP=15.0 ZERO_O_PROJ_INIT=1
b89b9b3	2.626968	2.7	discard	gpu0 best run1773491119 DEPTH=8 HEAD_DIM=32 ASPECT_RATIO=64 H_CYCLES=3 L_CYCLES=2 FORWARD_DTYPE=bfloat16 PRENORM=0 LAYER_SCALE_INIT=0.0 DEVICE_BATCH_SIZE=2 TOTAL_BATCH_SIZE=65536 EMBEDDING_LR=0.3 MATRIX_LR=0.04 UNEMBEDDING_LR=0.004 WEIGHT_DECAY=0.15 WARMUP_RATIO=0.02 WARMDOWN_RATIO=0.5 FINAL_LR_FRAC=0.0 LOGITS_SOFTCAP=15.0 ZERO_O_PROJ_INIT=1
b89b9b3	2.626658	2.7	discard	gpu0 best run1773491734 DEPTH=8 HEAD_DIM=32 ASPECT_RATIO=64 H_CYCLES=2 L_CYCLES=2 FORWARD_DTYPE=bfloat16 PRENORM=0 LAYER_SCALE_INIT=0.0 DEVICE_BATCH_SIZE=2 TOTAL_BATCH_SIZE=65536 EMBEDDING_LR=0.3 MATRIX_LR=0.044351174853283215 UNEMBEDDING_LR=0.0035354440460033296 WEIGHT_DECAY=0.15 WARMUP_RATIO=0.0 WARMDOWN_RATIO=0.5 FINAL_LR_FRAC=0.0 LOGITS_SOFTCAP=15.0 ZERO_O_PROJ_INIT=1
b89b9b3	2.626978	2.7	discard	gpu2 promising run1773491734 DEPTH=8 HEAD_DIM=32 ASPECT_RATIO=64 H_CYCLES=3 L_CYCLES=2 FORWARD_DTYPE=bfloat16 PRENORM=0 LAYER_SCALE_INIT=0.0 DEVICE_BATCH_SIZE=2 TOTAL_BATCH_SIZE=65536 EMBEDDING_LR=0.3 MATRIX_LR=0.039416280899984696 UNEMBEDDING_LR=0.004 WEIGHT_DECAY=0.15 WARMUP_RATIO=0.02 WARMDOWN_RATIO=0.5 FINAL_LR_FRAC=0.0 LOGITS_SOFTCAP=15.0 ZERO_O_PROJ_INIT=1
b89b9b3	2.626985	2.9	discard	gpu1 second run1773491734 DEPTH=8 HEAD_DIM=32 ASPECT_RATIO=67 H_CYCLES=2 L_CYCLES=2 FORWARD_DTYPE=bfloat16 PRENORM=0 LAYER_SCALE_INIT=0.0 DEVICE_BATCH_SIZE=2 TOTAL_BATCH_SIZE=65536 EMBEDDING_LR=0.3 MATRIX_LR=0.04 UNEMBEDDING_LR=0.004 WEIGHT_DECAY=0.15 WARMUP_RATIO=0.02 WARMDOWN_RATIO=0.5 FINAL_LR_FRAC=0.0 LOGITS_SOFTCAP=15.0 ZERO_O_PROJ_INIT=1
b89b9b3	2.626857	2.7	discard	gpu3 mix run1773491734 DEPTH=8 HEAD_DIM=32 ASPECT_RATIO=64 H_CYCLES=2 L_CYCLES=3 FORWARD_DTYPE=bfloat16 PRENORM=0 LAYER_SCALE_INIT=0.0 DEVICE_BATCH_SIZE=2 TOTAL_BATCH_SIZE=65536 EMBEDDING_LR=0.3 MATRIX_LR=0.04 UNEMBEDDING_LR=0.004 WEIGHT_DECAY=0.15 WARMUP_RATIO=0.02 WARMDOWN_RATIO=0.5 FINAL_LR_FRAC=0.0 LOGITS_SOFTCAP=15.0 ZERO_O_PROJ_INIT=1
